YearAndSession,BillNumber,Title,Synopsis,bill_summary,programmatic,program_start_year,program_end_year,funding,responsible_party,stakeholders,access_to_capital_summary,access_to_capital_score
2025 Regular Session,HB0761,Maryland Uniform Disposition of Abandoned Property Act - Revisions,Making certain virtual currency subject to the abandoned property laws in the State; establishing certain provisions to determine certain information about certain apparent owners of abandoned property; altering and establishing certain provisions pertaining to the presumption of abandonment for certain types of property; establishing certain procedures to establish the death of a certain insured or certain annuitant; altering from $100 to $50 the value at which the Comptroller is required to publish a certain notice; etc.,"This bill revises Maryland's laws on unclaimed property, including virtual currency, and updates procedures for handling abandoned property, claims, and the responsibilities of the State Comptroller.",False,2025,2025,0.0,Maryland Office of the Comptroller,"Owners of unclaimed property, including virtual currency holders, and financial institutions in Maryland.",The bill's impact on access to capital is minimal as it mainly updates legal procedures and definitions related to unclaimed property.,2.0
2025 Regular Session,HB0765,Hospitals - Medical Debt Collection - Sale of Patient Debt,"Authorizing a hospital, under certain circumstances, to sell the medical debt of patients if the debt is sold to a governmental unit or an entity that is under contract with the unit or a nonprofit organization for the purpose of canceling the debt; requiring that a hospital's financial policy require the hospital to dismiss actions pending against a patient for the collection of debt that was sold and prohibit the hospital from engaging in specified collection activities; etc.","This bill regulates hospital debt collection practices in Maryland, including restrictions on selling patient debt, requirements for hospitals to report on debt collection, and procedures for debt cancellation and patient notification.",True,2025,2028,0.0,Maryland Health – General (the Maryland Department of Health),"Hospital patients, especially those with medical debt or seeking free or reduced-cost care in Maryland","The bill's restrictions on debt selling and collection activities could limit the ability of small business owners (such as debt collectors or financial institutions) to access certain types of medical debt, potentially reducing available capital from this source.",4.0
2025 Regular Session,HB0767,"Real Property - Landlord and Tenant - Procedures for Failure to Pay Rent, Breach of Lease, and Tenant Holding Over","Requiring a landlord to provide certain notice to a tenant when a court has issued a warrant of restitution for a failure of a tenant to pay rent, a breach of lease, or a tenant holding over under certain circumstances; establishing certain procedures and requirements for the execution of a warrant for repossession; establishing that the Act does not restrict the authority of the State or a local jurisdiction to enact or enforce certain legislation; applying the Act prospectively; etc.","This bill establishes new procedures and requirements for landlords and courts regarding eviction processes, including notice requirements, execution of warrants for repossession, and handling of tenants' personal property after eviction.",False,2025,2025,0.0,Maryland District Courts and local law enforcement agencies,"Tenants and landlords in Maryland, especially those involved in eviction proceedings","The bill primarily changes eviction procedures and property handling, with no direct impact on small business access to capital.",1.0
2025 Regular Session,HB0774,Higher Education - Hunger-Free Campus Grant Program - Alterations,Requiring the Maryland Higher Education Commission to designate certain private institutions of higher education as hunger-free campuses; and prohibiting certain private institutions of higher education from being eligible to receive grant funding under the Hunger-Free Campus Grant Program.,"The bill establishes the Hunger–Free Campus Grant Program to designate certain higher education campuses as hunger–free, provide funding for initiatives to address student food insecurity, and require reporting on the program's impact.",True,2023,2026,525000.0,Maryland Higher Education Commission,Students at higher education institutions facing food insecurity,The program has a high potential to improve access to capital for initiatives supporting food-insecure students through grants and seed funding.,8.0
2025 Regular Session,HB0775,Correctional Services - Death of Incarcerated Individual - Notification,Requiring the Commissioner of Correction to notify certain elected representatives whenever an incarcerated individual dies in a Division of Correction facility; and requiring the Department of Public Safety and Correctional Services to adopt certain regulations compliant with the federal Health Insurance Portability and Accountability Act.,"This bill requires the Maryland Department of Correction to notify certain officials and representatives when an incarcerated individual dies in custody, including the cause of death and ensuring compliance with privacy laws.",False,2025,2025,0.0,Department of Public Safety and Correctional Services,"Incarcerated individuals, their families, correctional facility staff, and government officials",The bill does not directly impact access to capital for small business owners.,1.0
2025 Regular Session,HB0776,Maryland Medical Practice Act and Maryland Physician Assistants Act - Revisions,"Repealing obsolete and redundant language in, clarifying language in, and making language consistent across certain provisions of law governing the State Board of Physicians and the regulation of physicians, physician assistants, and allied health professionals; altering certain licensure requirements; altering the grounds for discipline for physicians, physician assistants, and allied health professionals; authorizing the Board to impose a civil penalty for a certain report made in bad faith; etc.","This bill updates and clarifies regulations governing physicians, physician assistants, and allied health professionals in Maryland, including licensure, disciplinary procedures, reporting requirements, and program structures.",False,2025,2025,0.0,Maryland State Board of Physicians,"Physicians, physician assistants, allied health professionals, and the public in Maryland",The bill mainly changes regulatory and disciplinary procedures and does not establish a distinct service or intervention for public access to capital.,1.0
2025 Regular Session,HB0782,Study on Detecting Deadly Weapons in Public Middle and High Schools,"Requiring the Maryland Center for School Safety to study how best to detect deadly weapons in public middle and high schools and how best to rapidly report the detection of weapons to a law enforcement agency; requiring the Center to request any available assessment technologies evaluated under the Act; and requiring the Center to issue an interim report by December 1, 2025, and a final report on the findings of the study, in a manner that does not jeopardize school safety, by December 1, 2026, to","This bill requires the Maryland Center for School Safety to study how to detect deadly weapons in public middle and high schools and how to improve reporting of such weapons to law enforcement. It includes evaluating current security measures, exploring new technologies like AI and metal detectors, and assessing the use of security cameras.",True,2025,2027,0.0,Maryland Center for School Safety,"Public middle and high school students, school staff, law enforcement agencies, and school administrators","The bill's focus is on evaluating and improving security measures and technologies, which could impact access to capital for security vendors and technology providers, but it does not directly establish a new program or fund.",4.0
2025 Regular Session,HB0783,Health Occupations - Implicit Bias and Structural Racism Training,"Requiring applicants for renewal of certain licenses and certain certificates issued by certain health occupation boards to attest that the applicant completed an implicit bias and structural racism training program, rather than an implicit bias training program, approved by the Cultural and Linguistic Health Care Professional Competency Program; authorizing certain health occupations boards to adopt regulations allowing applicants renewing licenses to receive continuing education credits for completing certain training; etc.","The bill requires health care professionals in Maryland to complete implicit bias and structural racism training for license renewal, with the program being approved by the Cultural and Linguistic Health Care Professional Competency Program. It establishes the program, sets the timeline for implementation, and authorizes regulations for continuing education credits.",True,2026,0,0.0,Cultural and Linguistic Health Care Professional Competency Program and health occupations boards,"Health care professionals and patients in Maryland, especially from diverse and marginalized communities",The bill primarily focuses on training health care professionals and does not directly impact access to capital for small businesses.,1.0
2025 Regular Session,HB0784,Baltimore City - Alcoholic Beverages Licenses - Alterations,Authorizing the Board of License Commissioners for Baltimore City to provide a certain waiver from certain requirements for a restaurant within a certain bounded area in the 46th alcoholic beverages district; expanding the class of license to which a certain requirement for a memorandum of understanding applies to include any alcoholic beverages license in Baltimore City; providing an exception to a certain prohibition against the Board allowing a certain license transfer under certain circumstances; etc.,"The bill makes various changes to alcohol licensing laws in Baltimore City, including allowing waivers, expanding license types, requiring memoranda of understanding with community associations, extending license expiration dates for transfers, and setting rules for license transfers and conversions.",False,2025,2030,0.0,Baltimore City Board of License Commissioners,"Alcohol licensees, Baltimore City residents, community associations, small business owners in Baltimore City",The bill's provisions mainly relate to licensing rules and do not directly impact access to capital for small business owners.,1.0
2025 Regular Session,HB0785,Common Ownership Communities and Zoning Authorities - Operation of Family Child Care Homes - Limitations,Prohibiting a provision in certain documents of certain cooperative housing corporations from prohibiting or restricting the establishment or operation of certain family child care homes; prohibiting a provision in certain documents of certain cooperative housing corporations from limiting the number of children for which certain family child care homes provide family child care below the number authorized by the State Department of Education; etc.,"This bill prohibits certain restrictions and limitations on the operation of family child care homes within common ownership communities, condominiums, and local jurisdictions in Maryland. It ensures that such homes cannot be restricted below state-authorized capacity, and it limits the ability of associations and local laws to prohibit or restrict family child care operations.",True,2025,9999,0.0,Maryland Department of Education and local government agencies,"Family child care providers, families using child care, residents of common ownership communities, local jurisdictions","The bill's provisions primarily focus on restrictions and legal protections for family child care homes, and do not directly impact access to capital for small business owners.",1.0
2025 Regular Session,HB0786,Appellate Court of Maryland - Sessions at Educational Institutions,"Authorizing the Appellate Court of Maryland, in conjunction with the administrations of secondary and postsecondary educational institutions in the State, to hold sessions at certain secondary and postsecondary educational institutions in the State.","This bill authorizes the Appellate Court of Maryland to hold sessions at secondary and postsecondary educational institutions in the state, in addition to its usual location in Annapolis.",True,2025,2025,0.0,Appellate Court of Maryland,"Students, educational institutions, legal community in Maryland",The bill does not directly impact access to capital for small business owners.,1.0
2025 Regular Session,HB0787,Courts - State Reporter - Publication of Cases,Repealing a requirement that the State Reporter secure copyright for the State of published reports of opinions of the Supreme Court of Maryland and the Appellate Court of Maryland.,"The bill repeals the requirement that the Maryland State Reporter secure copyright for published reports of opinions of the Supreme Court and Appellate Court of Maryland, and clarifies the responsibilities of the State Reporter in preparing and publishing case reports.",False,2025,2025,0.0,Supreme Court of Maryland,"Legal professionals, courts, and the public interested in Maryland case law",The bill does not directly impact access to capital for small business owners.,1.0
2025 Regular Session,HB0788,Judiciary Department - Commission on Judicial Disabilities - Temporary Appointment,"Allowing the chair of the Commission on Judicial Disabilities to appoint a former member to temporarily fill a certain vacancy on the Commission; allowing the Governor, upon certain request of the chair, to appoint a temporary substitute member or extend the term of an existing member of the Commission; and requiring that any temporary substitute is subject to the same qualifications applicable to the member the substitute is replacing and if the member is a judge or an attorney, must be a member in good standing of the Maryland bar.","This bill proposes a constitutional amendment to allow the chair of the Commission on Judicial Disabilities to appoint a temporary member or extend a member’s term, particularly in cases of vacancies or recusals, and to permit the Governor to make such appointments upon request.",False,2026,0,0.0,Maryland General Assembly and the Governor of Maryland,"Judges, legal professionals, and the public involved with the judiciary in Maryland",The bill does not directly impact access to capital for small business owners.,1.0
2025 Regular Session,HB0790,Property Tax - Payment Plans - Notice to Taxpayers,Requiring the State Tax Sale Ombudsman to include certain information concerning a certain State installment payment program for property taxes on the Ombudsman's website; requiring the Ombudsman to contract with a vendor to operate an installment payment program for payment of taxes in which any homeowner may enroll; requiring a collector of taxes to include certain information concerning a certain State or local installment payment program for property taxes in a separate insert included with each property tax bill; etc.,"The bill requires the Maryland Department and local tax collectors to provide information about installment payment programs for property taxes to taxpayers through websites, notices, and property tax bills. It establishes a State Tax Sale Ombudsman to assist homeowners and provide resources to help them pay delinquent taxes and avoid tax sales.",True,2027,0,0.0,Maryland Department of Assessments and Taxation and local tax collectors,Homeowners with delinquent or overdue property taxes in Maryland,The bill has a high potential to improve access to capital for small business owners and homeowners by providing information and assistance on installment payment plans and related programs.,8.0
2025 Regular Session,HB0791,Somerset County - Property Tax - Emergency Services Tax,Authorizing the County Commissioners of Somerset County to impose an emergency services tax on all property subject to the county property tax to pay costs of emergency services; and prohibiting the county commissioners from initially imposing or subsequently increasing an emergency services tax until after a public hearing is held.,"The bill authorizes Somerset County to impose an emergency services property tax to fund fire, rescue, and emergency medical services, with rules for public hearings and collection procedures.",True,2025,0,0.0,Somerset County Commissioners,Property owners and residents of Somerset County who benefit from emergency services,"The program could improve funding for emergency services, potentially enhancing their capacity to serve the community, but it does not directly impact small business access to capital.",3.0
2025 Regular Session,HB0793,University System of Maryland - Academic Facilities Bonding Authority,"Approving certain projects for the acquisition, development, and improvement of certain academic facilities for the University System of Maryland; authorizing the issuance of bonds by the University System of Maryland in a total principal amount of $25,000,000 for financing the projects; and providing that the bonds issued under the authority of the Act are not a debt or obligation of the State or any of its subdivisions.","The bill authorizes the University System of Maryland to issue bonds totaling $30,000,000 to finance projects for academic facilities, including campus-wide improvements at the University of Maryland, College Park, and renewal projects for existing facilities.",False,2025,2025,30000000.0,University System of Maryland,"Students, faculty, and staff of the University System of Maryland, and the broader Maryland community benefiting from improved academic facilities.","The bill provides a direct financial mechanism (bond issuance) for funding academic facility projects, which can significantly impact the availability of capital for university infrastructure development.",7.0
2025 Regular Session,HB0795,Federal Public Service Loan Forgiveness Program - Employee Certification and Awareness Materials,"Establishing requirements related to the certification of employment by public service employers under the federal Public Service Loan Forgiveness Program, including requirements regarding determinations of whether employees are full-time; and requiring the Student Loan Ombudsman in the Office of the Commissioner of Financial Regulation to develop and disseminate information to increase awareness of and participation in the Program.","The bill establishes requirements for public service employers in Maryland to certify employment for employees participating in the federal Public Service Loan Forgiveness Program. It also mandates the development and dissemination of informational materials to increase awareness and participation in the program, and designates the Student Loan Ombudsman to oversee these efforts.",True,2025,9999,0.0,Office of the Commissioner of Financial Regulation and the Maryland Department of Labor,"Public service employees in Maryland, including government and nonprofit workers, and student loan borrowers",The program has a high potential to improve access to capital for small business owners who are public service employees by facilitating loan forgiveness.,8.0
2025 Regular Session,HB0796,Real Property – Filing Fee for Residential Mortgage Foreclosure – Increase,Increasing the filing fee required to accompany an order to docket or a complaint to foreclose a mortgage or deed of trust on residential property from $300 to $450.,"This bill increases the filing fee for residential mortgage foreclosure cases from $300 to $450, effective October 1, 2025.",False,2025,2025,450.0,Maryland Judiciary or the Office of Administrative Hearings,"Homeowners facing foreclosure, mortgage lenders, mortgage originators, and legal professionals involved in foreclosure proceedings",The bill's impact on access to capital is minimal as it primarily involves an increase in filing fees for foreclosure cases.,2.0
2025 Regular Session,HB0798,Opioid Restitution Fund - Interactive Dashboard,"Requiring the Maryland Office of Overdose Response, in collaboration with the Maryland Department of Health, to develop and maintain an interactive dashboard on Opioid Restitution Fund spending to share prescription opioid-related settlement information with the public; requiring the dashboard to include links to the State, county, or municipal websites that provide access to additional information on the use of opioid-related settlement funds; etc.","The bill requires the Maryland Office of Overdose Response, in collaboration with the Maryland Department of Health, to develop and maintain an interactive dashboard that displays information on the spending of the Opioid Restitution Fund, including settlement payments, past spending, and funded initiatives, with links to additional resources.",True,2025,0,0.0,Maryland Office of Overdose Response and Maryland Department of Health,"Public, local governments, and organizations involved in opioid settlement funds",The program primarily provides transparency and information about fund allocation rather than direct financial support or capital access for small businesses.,3.0
2025 Regular Session,HB0799,Economic Development - Maryland Innovation Initiative Institution Partnership Extension Program - Establishment,"Establishing the Maryland Innovation Initiative Institution Partnership Extension Program to expand opportunities for technology validation, entrepreneurial development, and industry engagement at eligible institutions; establishing eligibility criteria for project proposals to receive funding under the Program; authorizing the Governor to include an appropriation of $250,000 in the annual budget bill for fiscal years 2027 and 2028 for the Program; and altering the purpose and contents of the Maryland Innovation Initiative Fund.","The bill establishes the Maryland Innovation Initiative Partnership Extension Program to support technology validation, entrepreneurial development, and industry engagement at eligible universities and institutions of higher education in Maryland. It provides funding, sets eligibility criteria, and requires contributions from participating institutions.",True,2025,2028,750000.0,Maryland Department of Economic Development (or equivalent agency responsible for economic development and innovation programs),"Eligible universities, private nonprofit institutions of higher education, industry partners, and the broader Maryland economy.","The program aims to foster industry partnerships and support commercialization efforts, which could significantly improve small business owners' access to capital through grants and industry collaborations.",7.0
2025 Regular Session,HB0808,Columbia Association - Lease Requirements and Governing Documents Ho. Co. 14-25,Requiring a written lease for certain residential or commercial real property in Howard County to include information on the annual charge assessed by the Columbia Association and a description of certain rights and privileges under certain circumstances; requiring a landlord to provide a tenant with a copy of certain covenants and governing documents under certain circumstances; etc.,The bill requires landlords in Howard County to include specific information about the Columbia Association's annual charges and rights in written leases for residential and commercial properties. It also mandates landlords to provide tenants with copies of covenants and governing documents.,True,2025,9999,0.0,Howard County Department of Housing and Community Development,Tenants and landlords in Howard County subject to Columbia Association covenants,"The program enhances transparency and access to important property information, which could indirectly support better financial planning for tenants and landlords.",4.0
2025 Regular Session,HB0809,Out-of-Home Placement Providers - Individuals Enrolled in Higher Education and Vocational Training Programs,Authorizing an individual enrolled in an accredited institution of higher education or a residential vocational training program to return to an out-of-home placement provider with whom the individual was previously placed under certain circumstances; requiring an individual to make a request to a local department of social services at least 30 days before the scheduled break; requiring the local department to make a recommendation to the Department of Human Services not later than 21 days before the scheduled break; etc.,"The bill establishes regulations for out-of-home placement providers, including an exemption for individuals enrolled in higher education or vocational training programs, allowing them to return to previous placements under certain conditions.",True,2025,0,0.0,Department of Human Services,"Children in out-of-home placements, individuals enrolled in higher education or vocational training programs, and their families",The bill's focus is on placement regulations and does not directly impact access to capital for small business owners.,1.0
