YearAndSession,BillNumber,Title,Synopsis,bill_summary,programmatic,program_start_year,program_end_year,funding,responsible_party,stakeholders,access_to_capital_summary,access_to_capital_score
2025 Regular Session,HB0412,Elections - Local Boards of Elections - Open Meeting Requirements (Local Boards of Elections Transparency Act),"Requiring each local board of elections to make available on its website each open meeting agenda, a summary of any finalized documents, certain written testimony, and other materials on which the  board will be voting; requiring each local board to provide live video streaming of each open meeting and to maintain a complete and unedited archived video recording of each open meeting for 5 years; requiring the State Board of Elections to adopt regulations to ensure that the streaming requirements are met in a certain manner; etc.","The bill establishes enhanced open meeting requirements for local boards of elections in Maryland, including public access to agendas, live video streaming of meetings, and archiving of recordings for at least 5 years.",True,2025,2025,0.0,Maryland State Board of Elections,"Voters, local election boards, candidates, political parties, and the general public interested in election transparency","The bill primarily focuses on transparency and public access to election meetings and processes, not on access to capital for small businesses.",2.0
2025 Regular Session,HB0413,Criminal Law - Controlled Dangerous Substances and Firearms,"Authorizing a person who is at least 21 years of age to manufacture a personal use amount of cannabis products or concentrated cannabis for personal use or adult sharing at a private residence if the manufacturing process does not involve the use of a volatile solvent; specifying that manufacturing, distributing, dispensing, or possessing certain large quantities of certain controlled dangerous substances is a felony; altering the penalties for being a volume dealer and drug kingpin with regard to cannabis; etc.","This bill legalizes manufacturing a small amount of cannabis for personal use and adult sharing at private residences, with restrictions on the use of volatile solvents. It also revises penalties for large quantities of controlled substances and firearms, and provides for sentence modifications for certain past convictions related to drug offenses involving cannabis.",True,2025,2025,0.0,Maryland Department of Public Safety and Correctional Services,"Adults 21 years and older, individuals with past drug convictions, small business owners in the cannabis industry, law enforcement agencies",The bill's provisions on legal cannabis manufacturing and reduced penalties for certain drug offenses could improve access to capital for small cannabis businesses and individuals.,7.0
2025 Regular Session,HB0415,State Library Agency - Family Literacy Pilot Program - Establishment,"Establishing the Family Literacy Pilot Program administered by the State Library Agency in consultation with the Department of Public Safety and Correctional Services and the Correctional Education Council to enable certain incarcerated individuals to read aloud to their children by preparing a recording; and requiring the State Library Agency to submit a certain report on or before December 1, 2028.","The bill establishes the Family Literacy Pilot Program, which allows incarcerated individuals to record themselves reading children's books and send these recordings and books to their children, to foster family literacy and strengthen parent-child relationships.",True,2025,2028,0.0,Maryland State Library Agency,"Incarcerated individuals and their children, families, correctional facilities","The program is focused on literacy and family connection, not on access to capital for small businesses.",1.0
2025 Regular Session,HB0420,Education and Health - Emergency Use Epinephrine - Alterations,"Altering the defined term ""auto-injectable epinephrine"" to be ""emergency use epinephrine"" and to include certain drug delivery devices and products; and altering the name of the Emergency Use Auto-Injectable Epinephrine Program to be the Emergency Use Epinephrine Program.","The bill updates Maryland laws to expand the definition and use of emergency use epinephrine, including allowing schools, nonpublic schools, child care providers, youth camps, and certain institutions to store and administer epinephrine in emergency situations for allergic reactions, and establishes a statewide program for its use.",True,2025,9999,0.0,Maryland Department of Health,"Students, children, youth camp attendees, school personnel, child care providers, and the general public who may experience anaphylaxis","The bill creates a structured program for the storage and administration of emergency epinephrine, which could improve access to this critical medication in emergencies.",7.0
2025 Regular Session,HB0421,Public Safety - 9-1-1 Trust Fund - 9-8-8 Suicide Prevention Hotline,"Authorizing the use of the 9-1-1 Trust Fund for certain expenditures that support the 9-8-8 suicide prevention hotline; and altering a certain restriction on the use of the 9-1-1 Trust Fund to prohibit funds from being used for expenses solely related to the 9-8-8 suicide prevention hotline, instead of preventing the use of funds for any costs associated with the 9-8-8 suicide prevention hotline.","The bill authorizes the use of the 9–1–1 Trust Fund to support the 9–8–8 suicide prevention hotline, with specific restrictions on the types of costs that can be funded, and clarifies that funds cannot be used solely for the hotline.",True,2025,0,0.0,Maryland 9–1–1 Trust Fund and related public safety agencies,"Public safety answering points, emergency response agencies, and individuals seeking mental health support via the 9–8–8 hotline","The bill's impact on access to capital for small businesses is indirect, primarily through funding of emergency and mental health services rather than direct financial support or capital access programs.",3.0
2025 Regular Session,HB0423,Public Safety - Maryland 9-1-1 Board and Maryland Department of Emergency Management - Regulatory Authority,Authorizing the Maryland 9-1-1 Board to adopt regulations to implement and enforce certain responsibilities of the Board; and authorizing the Maryland Department of Emergency Management to adopt regulations to implement and enforce the responsibilities of the Department.,"This bill grants regulatory authority to the Maryland 9–1–1 Board and the Maryland Department of Emergency Management to adopt regulations for implementing and enforcing responsibilities related to 9–1–1 systems, including enhanced and Next Generation 9–1–1 services, standards, and personnel training.",True,2025,0,0.0,Maryland 9–1–1 Board and Maryland Department of Emergency Management,"Public safety answering points, emergency response personnel, and residents of Maryland who use 9–1–1 services","The bill primarily focuses on regulatory standards and training, with no direct programs aimed at increasing access to capital for small businesses.",1.0
2025 Regular Session,HB0424,Prescription Drug Affordability Board - Authority and Stakeholder Council Membership (Lowering Prescription Drug Costs for All Marylanders Now Act),"Altering the membership of the Prescription Drug Affordability Stakeholder Council; requiring the Prescription Drug Affordability Board, under certain circumstances, to establish a process for setting upper payment limits for purchases and payor reimbursements of prescription drug products that the Board determines have led or will lead to affordability challenges; authorizing the Board to reconsider an upper payment limit for a drug that becomes a current shortage; and altering requirements related to the setting of upper payment limits.","This bill establishes the Prescription Drug Affordability Board's authority to set upper payment limits for prescription drugs in Maryland, create a stakeholder council, and develop processes for managing drug affordability challenges, including considerations for shortages and specific populations.",True,2025,2030,0.0,Maryland Department of Health or Prescription Drug Affordability Board (implied),"Patients, pharmacies, healthcare providers, insurance carriers, pharmaceutical industry, and vulnerable populations in Maryland","The bill's focus is on drug pricing and reimbursement limits, which could influence the financial dynamics of pharmaceutical companies and healthcare providers, but it does not directly create a program to improve access to capital for small businesses.",3.0
2025 Regular Session,HB0425,Natural Resources - State Boat Act - Auctioneers,Exempting certain auctioneers from certain provisions of the State Boat Act.,"The bill exempts certain auctioneers from specific provisions of the State Boat Act, clarifying that licensed auctioneers acting on behalf of sellers, secured parties, or owners do not qualify as dealers under the law.",False,2025,2025,0.0,Maryland Department of Natural Resources,"Boat auctioneers, boat sellers, and owners in Maryland",The bill does not directly impact access to capital for small business owners.,1.0
2025 Regular Session,HB0426,Election Law - Postelection Tabulation Audits - Risk-Limiting Audits,"Requiring the State Board of Elections, in collaboration with the local boards of elections, to conduct a risk-limiting audit after each statewide election; authorizing the State Board, in collaboration with the local boards, to conduct a risk-limiting audit after a special general election; authorizing the State Board, in collaboration with the local boards, to conduct an automated software audit after a statewide election; authorizing a local board to conduct a risk-limiting audit of a local contest under certain circumstances; etc.","The bill requires the Maryland State Board of Elections to conduct risk-limiting audits after each statewide election, including automated software audits and manual audits of voter-verifiable paper records, to ensure the accuracy of vote tabulation.",True,2025,0,0.0,Maryland State Board of Elections,Voters and election officials in Maryland,The bill does not directly impact access to capital for small business owners.,1.0
2025 Regular Session,HB0427,State Board of Public Accountancy - Emeritus Status,Authorizing the State Board of Public Accountancy to place a licensee on emeritus status under certain circumstances; and requiring the Board to reinstate the license of an individual who is on emeritus status under certain circumstances.,"The bill authorizes the Maryland State Board of Public Accountancy to place licensed public accountants on emeritus status, allowing them to retire from active practice while maintaining a license that exempts them from certain requirements, and provides rules for reinstatement and usage of titles.",True,2025,0,0.0,Maryland State Board of Public Accountancy,"Certified Public Accountants in Maryland, retired accountants, and the public who rely on CPA services","The bill's impact on access to capital is indirect, mainly through allowing experienced accountants to retain a license and potentially provide services or mentorship, which could support small business growth.",4.0
2025 Regular Session,HB0428,Medical Debt - Complaints for Money Judgment and Real Property Liens,"Establishing certain requirements for a complaint for a money judgment; defining ""medical debt"" as a debt owed by a consumer to a provider of medical services, products, or devices, but does not include debt charged to a credit card except under certain circumstances; prohibiting the creation of a lien on owner-occupied residential property by contract or as a result of a breach of contract for the payment of medical debt; and applying the Act prospectively.","The bill establishes rules for medical debt judgments, prohibits creating liens on owner-occupied residential property for medical debt, and requires certain disclosures in legal complaints related to medical debt.",False,2025,2025,0.0,Maryland courts and legal system,Homeowners with owner-occupied residential property and medical debt creditors,"The bill reduces the ability of creditors to place liens on primary residences for medical debt, potentially limiting access to capital for medical debtors.",4.0
2025 Regular Session,HB0431,Consumer Protection - Consumer Contracts - Limitation Periods,Prohibiting a consumer contract from setting a shorter time to bring an action under or on the consumer contract than required by the law of the State; excluding certain entities from the application of this Act; and applying the Act prospectively.,"The bill prohibits consumer contracts from including provisions that set shorter time limits for legal actions than those required by Maryland law, making such provisions void and illegal. It also clarifies that violations are considered unfair trade practices.",True,2026,0,0.0,"Maryland courts and judicial system, specifically enforcement through the Commercial Law Article and Courts Article",Consumers entering into consumer contracts in Maryland,The bill's focus is on legal contract provisions and does not directly impact access to capital for small business owners.,1.0
2025 Regular Session,HB0436,Vehicle Laws - Medical Exemption for Enhanced Tinted Windows - Time Limitation,Repealing the 2-year time limitation on medical exemptions for enhanced tinted windows for vehicle owners with certain permanent medical conditions.,"The bill repeals the 2-year time limitation on medical exemptions for enhanced tinted windows on vehicles for owners with certain medical conditions, allowing such exemptions to be valid indefinitely if the condition is permanent.",False,2025,2025,0.0,Maryland Department of State Police,Vehicle owners with medical conditions requiring tinted windows,The bill does not directly impact access to capital for small business owners.,1.0
2025 Regular Session,HB0437,Criminal Law - Visual Surveillance With Prurient Intent - Modifications,"Altering the definition of ""private place"" as it relates to the prohibition on conducting visual surveillance with prurient intent of an individual without the consent of the individual to include a residence; and altering the prohibition against conducting visual surveillance with prurient intent.","The bill amends Maryland law to modify the definition of 'private place' and clarifies the prohibition on visual surveillance with prurient intent, including surveillance by cameras, in private places or private areas without consent.",False,2025,2025,0.0,Maryland Department of Public Safety or law enforcement agencies,Individuals whose private areas or private places may be surveilled without consent,The bill does not directly impact access to capital for small business owners.,1.0
2025 Regular Session,HB0438,Civil Actions - Tortious Injury to or Death of Pet - Compensatory Damages (Buddy's Law),"Increasing from $10,000 to $25,000 the maximum amount of compensatory damages that may be awarded to an owner of a pet from a person who tortiously causes an injury to or death of the pet while acting individually or through an animal under the person's ownership, direction, or control.","The bill increases the maximum amount of compensatory damages that can be awarded to pet owners when their pet is injured or killed due to someone else's tortious actions from $10,000 to $25,000.",False,2025,2025,0.0,Maryland courts and judicial system,Pet owners and pet owners' pets in Maryland,The bill does not directly impact access to capital for small business owners.,1.0
2025 Regular Session,HB0442,Criminal Procedure - Victims and Witnesses - Out of Court Statement of Child to Forensic Interviewer,Expanding the evidentiary rule on the admissibility of out of court statements made by child victims or witnesses to make admissible an out of court statement made by a child to a forensic interviewer.,"The bill expands the admissibility of out-of-court statements made by child victims or witnesses in criminal and juvenile court proceedings, specifically allowing statements made to forensic interviewers under certain conditions.",True,2025,2025,0.0,Maryland Judiciary or relevant court system,"Child victims and witnesses, legal professionals, child advocacy organizations, and the criminal justice system",The bill primarily changes evidentiary rules and does not directly impact access to capital for small businesses.,1.0
2025 Regular Session,HB0443,Baby Food Labeling - Statement Regarding Toxic Heavy Metal Testing - Terminology,"Altering the statement that must be included on a baby food product label if the baby food product has been tested for toxic heavy metals for the purpose of changing the term included on the label from ""toxic heavy metal"" to ""toxic element"".","This bill requires baby food manufacturers in Maryland to test their products for toxic heavy metals and include specific labeling information, including a QR code linking to test results and health guidance, starting in 2025. It also establishes testing and reporting requirements and restricts sales of products exceeding federal limits.",True,2025,2026,0.0,Maryland Department of Health,"Baby food manufacturers, parents, and children under 2 in Maryland","The program's focus on testing and transparent reporting could improve consumer trust and market access for compliant manufacturers, potentially impacting small businesses positively.",6.0
2025 Regular Session,HB0445,Criminal Law - Interference With a Public Safety Answering Point - Penalties,"Prohibiting a person from taking certain actions with the intent to interrupt or impair the functioning of a public safety answering point; and providing that a person who violates the Act is guilty of a felony and on conviction is subject to imprisonment not to exceed 5 years or a fine of up to $25,000 or both.","The bill enhances laws related to cybercrimes, specifically targeting acts that interfere with public safety answering points and other critical infrastructure, with increased penalties for violations.",False,2025,2025,0.0,Maryland Department of Public Safety and Correctional Services,"Public safety agencies, cybersecurity entities, and the general public",The bill does not directly impact access to capital for small businesses.,1.0
2025 Regular Session,HB0446,Natural Resources - Invasive Blue Catfish Pilot Program,"Establishing the Invasive Blue Catfish Pilot Program in the Department of Natural Resources to curb the spread of the invasive blue catfish in the Chesapeake Bay and its tributaries; requiring the Department to expand the use of practices determined to be effective under the Program; and requiring the Department to report to the Governor and the General Assembly by December 1, 2025, on its findings and recommendations based on the Pilot Program.",This bill establishes the Invasive Blue Catfish Pilot Program to control the spread of invasive blue catfish in the Chesapeake Bay and its tributaries. It includes provisions to expand fishing methods and regulations to increase harvest and manage the invasive species.,True,2025,2026,0.0,Department of Natural Resources,"Fishermen, environmental agencies, residents and ecosystems of the Chesapeake Bay area","The program may increase opportunities for commercial fishing, potentially improving access to capital for fishermen involved in blue catfish harvest.",7.0
2025 Regular Session,HB0447,"Anne Arundel County – Property Tax Credit – Habitat for Humanity of the Chesapeake, Incorporated","Altering the name of Arundel Habitat for Humanity, Inc., to be Habitat for Humanity of the Chesapeake, Incorporated, for purposes of a certain property tax credit against the county or municipal corporation tax imposed on the entity; and authorizing the tax credit for any real property owned by the entity.","The bill alters the name of Arundel Habitat for Humanity, Inc. to Habitat for Humanity of the Chesapeake, Incorporated, and authorizes a property tax credit for real property owned by this entity in Anne Arundel County.",False,2025,2025,0.0,Anne Arundel County government or municipal corporations within Anne Arundel County,"Habitat for Humanity of the Chesapeake, Inc. and property owners in Anne Arundel County",The bill does not directly create a program impacting access to capital for small businesses.,1.0
2025 Regular Session,HB0448,Modernization of Military Laws Act,"Establishing rules of interpretation related to the uniformed services; altering the rule of interpretation for ""veteran""; requiring the Secretary of Veterans and Military Families to develop certain policies related to life transitions of veterans, service members, and military families; and altering the application of certain provisions of law related to veterans, the uniformed services, and the filing of certificates of candidacy, the powers of the Governor, State veterans' cemeteries, and housing and employment discrimination.","The bill modernizes Maryland's military laws by establishing interpretation rules for military and veteran-related terms, creating policies for life transitions of veterans and service members, and making changes to laws regarding veterans' benefits, cemeteries, and employment preferences.",True,2025,2025,0.0,Department of Veterans and Military Families,"Veterans, service members, military families, and their dependents in Maryland","The bill primarily focuses on veterans' benefits, services, and legal definitions, with no direct programs aimed at increasing access to capital for small business owners.",1.0
2025 Regular Session,HB0450,Maryland Transit Administration - Disability Reduced Fare Program - Renewal for Permanently Disabled Individuals,Requiring the Maryland Transit Administration to automatically renew the Disability Reduced Fare Program certification of an enrollee who is permanently disabled.,The bill requires the Maryland Transit Administration to automatically renew the certification of individuals who are permanently disabled for the Disability Reduced Fare Program.,True,2025,0,0.0,Maryland Transit Administration,Individuals who are permanently disabled and use the reduced fare program,This bill does not directly impact access to capital for small business owners.,1.0
2025 Regular Session,HB0452,Outdoor Lighting - Guidance and Use of State Funds,"Requiring the Maryland Green Building Council, on or before October 1, 2026, to update or develop guidance for the purchase of outdoor lighting fixtures in consideration of certain recommendations; prohibiting State funds from being used to install or replace certain permanent outdoor luminaires for lighting unless certain requirements are met; altering the requirements for the use of State funds for the installation or replacement of certain permanent outdoor luminaires for lighting; applying the Act prospectively; etc.","The bill updates guidelines for outdoor lighting in Maryland, including restrictions on the use of state funds for outdoor luminaires, and requires the Maryland Green Building Council to develop or update guidance considering light pollution and color temperature. It also mandates a review of highway lighting practices by the Department of Transportation.",True,2025,2026,0.0,Maryland Green Building Council and Department of Transportation,"State agencies, outdoor lighting manufacturers, and the general public in Maryland",The bill's focus on guidelines and restrictions on outdoor lighting does not directly impact small business access to capital.,1.0
2025 Regular Session,HB0453,Anne Arundel County - Development Impact Fees,Altering the scope of certain limitations on the authority of the Anne Arundel County Council to grant exemptions from or credits against development impact fees.,"The bill amends the scope of exemptions and credits for development impact fees in Anne Arundel County, allowing the County Council to grant exemptions or credits for certain types of development projects, including affordable housing and land conveyances.",False,2025,2025,0.0,Anne Arundel County Council,"Developers, affordable housing projects, local government, residents of Anne Arundel County","The bill's focus on exemptions and credits for impact fees may indirectly influence the financial viability of development projects, but it does not directly establish a program to improve access to capital.",3.0
2025 Regular Session,HB0455,Braille Flag Memorial Act of 2025,"Requiring the Department of Veterans and Military Families to designate a location for an American braille tactile flag to be placed on the grounds of one or more State veterans' cemeteries to honor members of the uniformed services, veterans, and other individuals in the State who are blind or visually impaired.",The bill requires the Maryland Department of Veterans and Military Families to designate a location for an American braille tactile flag at one or more State veterans' cemeteries to honor blind and visually impaired veterans and service members.,True,2025,2025,0.0,Maryland Department of Veterans and Military Families,"Blind and visually impaired veterans and service members, visitors of State veterans' cemeteries",The bill does not directly impact access to capital for small business owners.,1.0
