YearAndSession,BillNumber,Title,Synopsis,bill_summary,programmatic,program_start_year,program_end_year,funding,responsible_party,stakeholders,access_to_capital_summary,access_to_capital_score
2025 Regular Session,HB0001,"Department of Transportation - Human Trafficking Awareness, Training, and Response (See Someone, Save Someone Act)","Requiring the Maryland Department of Transportation to develop or identify and implement a training program for transportation sector employees on the identification and reporting of suspected human trafficking victims; requiring transportation sector employers to certify by January 1, 2027, and each year thereafter that certain employees have completed the training program; requiring new employees to receive training within 90 days of hiring; removing civil and criminal liability for reporting of suspected trafficking; etc.","The bill requires the Maryland Department of Transportation to develop or identify and implement training programs for transportation-sector employees on identifying and reporting human trafficking. It also mandates certification of training completion, establishment of reporting procedures, and public awareness announcements.",True,2025,2026,0.0,Maryland Department of Transportation,"Transportation-sector employees, transportation employers, and potential human trafficking victims in Maryland","The program focuses on training and awareness, which may indirectly support victims but does not directly impact access to capital for small businesses.",3.0
2025 Regular Session,HB0003,State Board of Physical Therapy Examiners - Revisions,"Clarifying the definition of ""physical therapist assistant"" as used in the Maryland Physical Therapy Act to mean an individual licensed by the State Board of Physical Therapy Examiners; increasing the membership of the State Board of Physical Therapy Examiners from 8 to 9; and requiring the Board to send renewal notices to licensees by electronic means, rather than first-class mail, unless the licensee requests to receive the renewal notice by first-class mail.","The bill clarifies the definition of 'physical therapist assistant' in Maryland, adjusts the membership of the State Board of Physical Therapy Examiners, and changes the method of sending renewal notices to licensees from first-class mail to electronic means, with an option for licensees to request traditional mail.",False,2025,2025,0.0,State Board of Physical Therapy Examiners,Licensed physical therapists and physical therapist assistants in Maryland,The bill does not directly impact access to capital for small business owners.,1.0
2025 Regular Session,HB0004,Restrictions on Use - Solar Collector Systems - Alteration,Prohibiting a restriction on land use that increases the cost of installing a solar collector system by at least 5% over a certain cost or that reduces the efficiency of the system by at least 10% under a certain energy generation level; authorizing a community association to impose certain restrictions on the installation of solar collector systems in common areas or common elements; authorizing a community association to install a solar collector system in common areas or common elements under certain circumstances; etc.,"The bill prohibits restrictions on land use that significantly increase the cost or decrease the efficiency of installing solar collector systems, and allows community associations to regulate or prohibit the installation of solar systems in common areas, including the ability to install systems in those areas.",False,2025,2025,0.0,Maryland Department of Housing and Community Development or local land use authorities,"Property owners, community associations, solar energy system installers, residents interested in solar energy","The bill could facilitate the installation of solar systems by reducing restrictions, potentially lowering costs and increasing efficiency, which may improve access to solar-related capital for property owners.",7.0
2025 Regular Session,HB0009,Public Safety - Food System Resiliency Council - Definitions and Reports,"Altering certain definitions related to the Food Resiliency Council; defining what constitutes ""healthy food priority areas"" as predominantly lower-income areas that have limited access to retail outlets that sell, affordable, healthy foods; defining ""wasted food"" as food not used for its intended purpose; requiring the Council to make recommendations to increase the availability of local foods, create market opportunities for Maryland food businesses, and expand access to small scale food production infrastructure; etc.","This bill establishes the Maryland Food System Resiliency Council to address food insecurity, promote equitable access to healthy foods, reduce food waste, and support local food production and markets. It defines key terms, sets reporting requirements, and aims to improve the long-term resilience of Maryland's food system.",True,2025,0,0.0,Maryland Department of Emergency Management (Office of Resilience),"Residents of Maryland, especially those in food insecure areas, local food businesses, schools, and community organizations.","The bill has the potential to improve access to local food markets and infrastructure, which could facilitate small business growth and access to capital.",6.0
2025 Regular Session,HB0011,"Health Insurance - Access to Nonparticipating Providers - Referrals, Additional Assistance, and Coverage","Repealing the June 30, 2025, termination date for certain provisions of law related to referrals to and reimbursement of specialists and nonphysician specialists who are not part of a carrier's provider panel; prohibiting certain carriers from imposing utilization review requirements other than would be required if the covered benefit was provided by a provider on the carrier's provider panel under certain circumstances; etc.","The bill repeals the sunset date for laws requiring insurers to establish procedures for members to request referrals to specialists and nonphysician specialists outside of provider panels, especially for mental health and substance use disorder services. It also mandates insurers to assist members in finding and arranging coverage for such specialists, prohibits certain prior authorization requirements, and sets a reimbursement formula for nonparticipating providers.",True,2026,2025,0.0,Maryland Health Care Commission,"Members seeking mental health and substance use disorder services, mental health and substance use disorder providers, insurers, and the general public in Maryland.","The bill's provisions could improve access to mental health and substance use disorder services, potentially enabling providers to receive better reimbursement and thus improving their financial stability and capacity to serve more patients.",7.0
2025 Regular Session,HB0012,Cannabis - Sale and Distribution - Tetrahydrocannabinol Offenses,"Authorizing the officers and employees of the Field Enforcement Division of the Alcohol, Tobacco, and Cannabis Commission to issue a citation for a violation of §10-108 of the Criminal Law Article; prohibiting the sale or distribution of certain products that contain tetrahydrocannabinol or are advertised as containing tetrahydrocannabinol; authorizing the Executive Director of the Commission to seize, destroy, or confiscate a certain unlawful product; etc.","The bill updates Maryland laws regarding the sale, distribution, and regulation of tetrahydrocannabinol (THC) and related products, including establishing enforcement authority, defining legal standards, and setting penalties for violations.",False,2025,2025,0.0,"Maryland Alcohol, Tobacco, and Cannabis Commission","Cannabis producers, sellers, consumers, and law enforcement in Maryland",The bill does not directly create or expand programs that impact small business access to capital.,1.0
2025 Regular Session,HB0015,Corporations and Associations - Limited Worker Cooperative Associations - Authorization (Maryland Limited Worker Cooperative Association Act),"Authorizing the formation of limited worker cooperative associations; and establishing rules and procedures for the formation, governance, conversion, and dissolution of limited worker cooperative associations.","The bill authorizes the formation of limited worker cooperative associations in Maryland, establishing rules for their formation, governance, conversion, and dissolution, and creating a new legal framework for these entities.",True,2026,9999,0.0,Maryland Department of Commerce or equivalent state agency responsible for business regulation and registration,Workers and small business owners interested in forming or operating worker cooperatives in Maryland,"The bill has the potential to improve access to capital for worker cooperatives by establishing clear legal and governance structures, but direct impact on capital access is moderate.",6.0
2025 Regular Session,HB0018,Vehicle Laws - Noise Abatement Monitoring Systems Pilot Program - Inspection and Extension,Establishing that certain provisions of law relating to the inspection of recorded images apply to recorded images produced by a noise abatement monitoring system; and extending by 2 years the reporting and termination dates of the noise abatement monitoring systems pilot programs in Montgomery County and Prince George's County.,"The bill extends the pilot programs for noise abatement monitoring systems in Montgomery County and Prince George's County, including systems that record images related to noise violations, and clarifies legal provisions regarding access to recorded images. It also requires counties to report on the use and effectiveness of these systems and extends the duration of the pilot programs.",True,2024,2028,0.0,Maryland Department of Transportation or local county agencies implementing noise monitoring systems,"Residents and motorists in Montgomery County and Prince George's County, local government agencies, and law enforcement",The program has a high potential to impact small business owners' access to capital by providing data and enforcement mechanisms that could influence noise-related regulations and compliance costs.,7.0
2025 Regular Session,HB0019,"Health Occupations - Nursing - Loan Repayment, Education, and Sunset Extension (Building Opportunities for Nurses Act of 2025)",Expanding the purpose of the Maryland Loan Assistance Repayment Program for Nurses and Nursing Support Staff; requiring the Department to prioritize funding for nurses or nursing support staff who practice in an area with a shortage of nurses or nursing support staff or who practice in a specialty where a shortage has been identified; altering certain education requirements for licensure; repealing a certain requirement that the State Board of Nursing approve certain nursing assistant training program sites within a certain time period; etc.,"The bill extends and modifies the Maryland Loan Assistance Repayment Program for nurses, updates licensing requirements for nursing assistants, and makes related changes to nursing education and staffing regulations, including extending the sunset date for certain programs to 2030.",True,2026,2030,0.0,Maryland Department of Health and Maryland Board of Nursing,"Nurses, nursing support staff, nursing students, healthcare facilities in Maryland, and residents needing healthcare services",The bill has a high potential to impact small business owners and healthcare providers by improving staffing and supporting workforce development through loan repayment programs.,8.0
2025 Regular Session,HB0022,Department of Public Safety and Correctional Services - Study on Location of Individuals Prior to and Following Incarceration,"Requiring the Department of Public Safety and Correctional Services to conduct an annual study examining and comparing certain data regarding an individual's residence prior to incarceration and on release from a State correctional facility; and requiring the Department by October 1, 2026, and each October 1 thereafter, to report the results of the study to certain committees of the General Assembly.","This bill requires the Maryland Department of Public Safety and Correctional Services to conduct a study on the residence locations of individuals before and after incarceration, including data on their county of residence, transfer details, and comparisons of release locations, with reports due annually.",False,2025,2026,0.0,Department of Public Safety and Correctional Services,Individuals incarcerated in Maryland and their communities,The bill does not directly impact access to capital for small business owners.,1.0
2025 Regular Session,HB0025,Environment – Reservoir Augmentation Permit – Establishment,"Establishing the Reservoir Augmentation Program in the Department of the Environment; defining ""reservoir augmentation"" as the planned placement of reclaimed water into a surface water reservoir used as a source for a drinking water treatment facility; requiring a person to obtain a permit from the Department to perform reservoir augmentation; establishing an Indirect Potable Reuse Pilot Program in the Department to make recommendations on whether the program should be extended or made permanent and any statutory or regulatory changes necessary; etc.","The bill establishes the Reservoir Augmentation Program in the Maryland Department of the Environment, requiring permits for reservoir augmentation using reclaimed water, and sets rules for issuing, renewing, and revoking these permits, along with funding and reporting requirements.",True,2025,2030,0.0,Maryland Department of the Environment,"Public water systems, environmental agencies, and communities relying on surface water reservoirs","The program could improve access to safe, reliable water sources, potentially reducing costs and barriers for small water systems and communities.",7.0
2025 Regular Session,HB0027,Estates and Trusts - Compensation of Guardians of Property and Trustees,Clarifying the commissions that a guardian of the property may charge; authorizing a trustee of a trust to charge compensation that is reasonable under the circumstances; and authorizing trustees who are financial institutions or members of the Maryland Bar to charge compensation that is reasonable under the circumstances and calculated in accordance with a schedule of rates filed with an appropriate agency.,"This bill clarifies and updates the rules regarding the compensation that guardians of property and trustees of trusts can charge, including establishing reasonable compensation standards, schedules of rates, and procedures for approval and notification.",False,2025,2025,0.0,Maryland Courts and the Office of the Commissioner of Financial Regulation,"Guardians of property, trustees, and beneficiaries of estates and trusts in Maryland",The bill's impact on access to capital is minimal as it mainly addresses legal and procedural standards for trustee and guardian compensation.,2.0
2025 Regular Session,HB0031,Consumer Protection - Right to Repair - Powered Wheelchairs,"Requiring, in order to make repairs to powered wheelchairs, that a certain manufacturer make available certain documentation, parts, embedded software, firmware, and tools to a certain independent repair provider or owner of a powered wheelchair; providing that a violation of the Act constitutes an unfair, abusive, or deceptive trade practice subject to certain enforcement and penalty provisions; and applying the Act prospectively.","This bill requires manufacturers of powered wheelchairs to provide independent repair providers and owners with access to documentation, parts, embedded software, firmware, and tools necessary for repairs, under fair and reasonable terms and costs.",True,2025,0,0.0,Maryland Department of Commerce or relevant state agency responsible for consumer protection and medical device regulation,"Owners of powered wheelchairs, independent repair providers, and manufacturers of powered wheelchairs in Maryland","The program has high potential to impact small business owners by reducing costs and barriers to repairing powered wheelchairs, thus improving access to repair services.",8.0
2025 Regular Session,HB0032,Maryland Department of Health - Forensic Review Board - Established,Requiring the Maryland Department of Health to establish a forensic review board at facilities that have charge of persons who have been committed to the facility as not criminally responsible; authorizing a forensic review board to make recommendations relating to the release or rehabilitation of a committed person; requiring the board to give notice at least 10 days before a meeting concerning the committed person; requiring the board to give consideration to a written statement offered by the committed person to the board; etc.,"The bill establishes forensic review boards at facilities with persons committed as not criminally responsible, to review their eligibility for release and make recommendations. It also creates a Community Forensic Aftercare Program to monitor these individuals on conditional release.",True,2025,0,0.0,Maryland Department of Health,"Persons committed as not criminally responsible, mental health professionals, courts, and the Maryland Department of Health",The bill's focus is on monitoring and review processes rather than direct financial support or capital access programs.,1.0
2025 Regular Session,HB0033,Department of Service and Civic Innovation - Maryland Corps Program Service Year Option Pathways - Revisions,Altering the duties of the Department of Service and Civic Innovation; renaming the Governor's Volunteer Council to be the Governor's Commission on Service and Volunteerism; altering certain requirements relating to qualifications for applicants and compensation for participants in the Young Adult Service Year Option Pathway and the Maryland Service Year Option Pathway; altering certain reporting requirements; and repealing the Executive Fellows Program.,"The bill revises the Maryland Corps Program, establishing two new pathways: the Young Adult Service Year Pathway and the Maryland Service Year Pathway. It sets program goals, funding, participant requirements, and reporting obligations, and renames the Governor’s Volunteer Council to the Governor’s Commission on Service and Volunteerism.",True,2025,2026,50000000.0,Department of Service and Civic Innovation,"Young adults, Maryland residents, state and local government agencies, community organizations, and employers","The bill creates structured pathways with stipends and awards, potentially increasing access to capital for participants and organizations involved.",8.0
2025 Regular Session,HB0036,Department of Aging – Aging Services – Program Repeal and Consolidation,"Repealing provisions of law requiring the Secretary of Aging to develop certain congregate housing and assisted living programs for seniors; repealing the Interagency Committee on Aging Services and transferring certain responsibilities of the Committee to the Department of Aging; requiring the Department, beginning in June 2025, in coordination with area stakeholders, to conduct program transition planning and to co-design the new, consolidated program required by the Act; etc.","The bill repeals certain aging programs and committees, consolidates responsibilities into the Department of Aging, and establishes a new program to provide a single point of entry for services to older adults, including assessments and access to various support services.",True,2025,2026,0.0,Department of Aging,Older adults in Maryland and their caregivers,The bill's focus is on service coordination and access rather than direct financial support or capital access for small businesses.,2.0
2025 Regular Session,HB0039,Public Health - Repeal of Prohibition on Transfer of Human Immunodeficiency Virus (Carlton R. Smith Act),Repealing the prohibition on an individual from knowingly transferring or attempting to transfer the human immunodeficiency virus to another individual.,"The bill repeals the existing prohibition on knowingly transferring or attempting to transfer the human immunodeficiency virus (HIV) to another individual, effectively removing criminal penalties for such actions.",False,2025,2025,0.0,Maryland Department of Health,Individuals living with HIV and the general public,The bill does not directly impact access to capital for small business owners.,1.0
2025 Regular Session,HB0040,Natural Resources - Fishing Licenses and Stamps - Alterations,"Altering the fees for resident consolidated senior sport fishing licenses, angler's licenses, and trout stamps; and repealing the exemption from the requirement to obtain a trout stamp under certain circumstances for a holder of a resident consolidated senior sport fishing license.","The bill increases fees for certain fishing licenses and stamps in Maryland, repeals some exemptions, and establishes a program for discounted licenses for Purple Heart recipients.",False,2025,2025,0.0,Maryland Department of Natural Resources,"Maryland residents who fish, especially senior citizens and disabled persons, and military service members",The bill does not directly impact access to capital for small business owners.,1.0
2025 Regular Session,HB0041,Election Law - Petitions for the Formation of a New Political Party - Process,Altering the time periods during which a petition for the formation of a new political party or additional signatures to a petition may not be filed; and prohibiting signatures submitted with a petition that was officially determined as not meeting certain legal requirements from being resubmitted with a subsequent petition.,"The bill amends Maryland election law to change the time periods during which petitions for the formation of a new political party can be filed, and prohibits resubmission of signatures if a petition fails to meet legal requirements.",False,2025,2025,0.0,Maryland State Board of Elections,Individuals and groups interested in forming new political parties in Maryland,The bill does not directly impact access to capital for small business owners.,1.0
2025 Regular Session,HB0043,Federally Qualified Health Centers Grant Program - Acquisition of Land,"Authorizing the Board of Public Works, on recommendation of the Secretary of Health, to make grants under the Federally Qualified Health Centers Grant Program to counties, municipal corporations, and nonprofit corporations for the acquisition of land for the construction or use of a federally qualified health center.","The bill authorizes the Maryland Board of Public Works, based on the recommendation of the Secretary of Health, to provide grants to counties, municipal corporations, and nonprofit organizations for acquiring land to build or use federally qualified health centers, as part of the existing Federally Qualified Health Centers Grant Program.",True,2025,0,0.0,"Board of Public Works, Maryland Department of Health","Counties, municipal corporations, nonprofit organizations, and residents who will access federally qualified health centers",The program has a high potential to impact small business owners and organizations seeking to acquire land for health centers by providing grants for land acquisition.,8.0
2025 Regular Session,HB0046,Public Health - Cannabis Public Health Advisory Council - Membership,"Altering the membership of the Cannabis Public Health Advisory Council to include the Administrator of the Motor Vehicle Administration, or the Administrator's designee, and the Executive Director of the Office of Social Equity in the Maryland Cannabis Administration, or the Executive Director's designee.","This bill amends the membership composition of the Cannabis Public Health Advisory Council in Maryland, adding new members appointed by the Governor, including representatives from historically black colleges, health care providers, pharmacists, researchers, and industry stakeholders.",False,2025,0,0.0,Maryland Cannabis Administration and other state agencies involved in public health and cannabis regulation,"Public health officials, cannabis industry stakeholders, healthcare providers, researchers, and residents of Maryland",The bill does not directly establish or fund programs that impact access to capital for small business owners.,1.0
2025 Regular Session,HB0049,Environment - Building Energy Performance Standards - Alterations and Analysis,"Altering the requirements for certain regulations adopted by the Department of the Environment relating to building energy performance standards to include certain exclusions, considerations, and a certain  annual reporting fee to cover certain costs; requiring the Department to certify a certain building energy performance standards program adopted by a county under certain circumstances; requiring the Department to conduct an analysis of the potential costs and benefits of certain building energy performance standards policy options; etc.","This bill establishes regulations and standards for building energy performance in Maryland, including targets, exemptions, and alternative compliance pathways, and creates a program for fees and incentives related to greenhouse gas emissions and energy use in large buildings.",False,2025,2040,0.0,Maryland Department of the Environment,"Owners and operators of large commercial and multifamily buildings in Maryland, including government agencies and private sector entities","The bill introduces fees, waivers, and incentives that could influence the financial strategies of building owners, potentially impacting their access to capital for energy efficiency projects.",6.0
