YearAndSession,BillNumber,Title,Synopsis,bill_summary,programmatic,program_start_year,program_end_year,funding,responsible_party,stakeholders,access_to_capital_summary,access_to_capital_score
2025 Regular Session,HB1227,Montgomery County - School Bus Stops on Highways - Alterations MC 8-25,"Applying certain provisions of law regarding school bus stops located on certain highways in Montgomery County to a school bus stop at a location for which at least 400 citations were issued in the preceding fiscal year to drivers traveling in the opposite direction of the bus stop; and prohibiting, beginning on December 31, 2028, locating a school bus stop on any highway with five or more undivided traffic lanes, except under certain circumstances.","The bill modifies how traffic fines collected in Montgomery County are paid and used, directs that fines from certain traffic violations be paid directly to Montgomery County or the District Court, and allocates the funds for specific purposes such as constructing median dividers on highways. It also establishes new rules for school bus stops on highways in Montgomery County, including requirements for posting school crossing guards or traffic control devices at bus stops with high citation volumes.",True,2025,2028,0.0,Montgomery County Department of Transportation and Maryland State Highway Administration,"Drivers, school children, Montgomery County residents, and local government agencies","The bill's impact on access to capital for small business owners is indirect, primarily through the allocation of traffic fine revenues for infrastructure projects.",3.0
2025 Regular Session,HB1228,Department of Commerce - Montgomery County Agricultural Reserve Study MC 15-25,"Requiring the Department of Commerce, in coordination with certain county agencies and organizations, to study economic development in and the tourist and visitor economy of the Montgomery County Agricultural Reserve and, on or before June 30, 2026, report its findings to the members of the Montgomery County Delegation to the General Assembly; and requiring the Department to make recommendations regarding policies and programs that can help promote and preserve the Montgomery County Agricultural Reserve.","The bill requires the Maryland Department of Commerce to study the economic development and tourism impact of the Montgomery County Agricultural Reserve, and to report findings and recommendations to support the reserve and local small businesses that depend on tourism.",True,2025,2026,0.0,Maryland Department of Commerce in coordination with Montgomery County agencies and organizations,"Small businesses, recreation sites, historic sites, and residents in Montgomery County Agricultural Reserve and visitors/tourists","The program aims to understand and enhance the visitor economy, which could indirectly support small business access to capital, but does not directly provide capital or financial services.",4.0
2025 Regular Session,HB1230,Washington Suburban Sanitary Commission - System Development Charge - Exemptions MC/PG 107-25,"Requiring, rather than authorizing, the Montgomery County Council and the Prince George's County Council to grant exemptions from the system development charge imposed by the Washington Suburban Sanitary Commission for certain properties and projects located in Montgomery County; limiting the exemption to $80,000; altering the method by which the county councils establish eligibility for the exemptions; prohibiting the county councils from requiring that an applicant for an exemption own the property for which the exemption is sought; etc.","The bill requires the Montgomery County and Prince George's County Councils to grant exemptions from the system development charge imposed by the Washington Suburban Sanitary Commission for certain properties and projects, with specific eligibility criteria and a first-come, first-served application process until a maximum annual limit is reached.",True,2025,2025,0.0,Montgomery County Council and Prince George's County Council,"Property owners and developers in Montgomery County and Prince George's County, especially those involved in revitalization, affordable housing, community organizations, child care, and programs for disabled individuals.","The bill's provisions for exemptions could reduce costs for certain property owners, potentially improving access to capital for projects that qualify.",6.0
2025 Regular Session,HB1236,Queen Anne's County - Municipalities - Speed Limits,Authorizing municipalities in Queen Anne's County to decrease the maximum speed limit to not less than 15 miles per hour on highways without performing an engineering and traffic investigation.,The bill authorizes municipalities in Queen Anne's County to reduce the maximum speed limit on highways to not less than 15 miles per hour without conducting an engineering and traffic investigation.,False,2025,2025,0.0,Municipalities in Queen Anne's County,Residents and motorists in Queen Anne's County and its municipalities,The bill does not directly impact access to capital for small business owners.,1.0
2025 Regular Session,HB1238,Somerset County - Alcoholic Beverages - Liquor Tasting License,"Establishing a liquor tasting license in Somerset County; authorizing the Board of License Commissioners for Somerset County to issue the license to the holder of a Class A beer, wine, and liquor license; and establishing liquor tasting license fees.","The bill establishes a liquor tasting license in Somerset County, allowing holders of Class A beer, wine, and liquor licenses to permit consumers to taste liquor without charge, under specified conditions and quantities.",True,2025,0,0.0,Board of License Commissioners for Somerset County,Liquor license holders and consumers in Somerset County,"The program could facilitate small business growth by allowing license holders to promote their products through tastings, potentially increasing sales and customer engagement.",6.0
2025 Regular Session,HB1243,Health Insurance - Coverage for Specialty Drugs,"Prohibiting certain insurers, nonprofit health service plans, and health maintenance organizations from excluding coverage for certain specialty drugs that are administered or dispensed by a provider that is an in-network provider of covered medical oncology services and complies with State regulations for the administering and dispensing of specialty drugs, if the specialty drugs meet certain qualifications; and requiring the reimbursement rate for certain specialty drugs to meet certain criteria.","The bill prohibits certain health insurers and plans from excluding coverage for specific specialty drugs that are administered or dispensed by qualified providers, sets reimbursement standards for these drugs, and regulates pharmacy benefits managers' practices related to specialty drugs and pharmacy networks.",True,2026,0,0.0,Maryland Department of Health and Insurance Commission,"Patients requiring specialty drugs, healthcare providers, insurers, pharmacy benefits managers, and small business owners in the pharmacy sector","The bill's impact on access to capital is indirect, primarily through regulation of reimbursement rates and pharmacy network practices, which could influence the financial stability of providers and pharmacy benefits managers.",4.0
2025 Regular Session,HB1244,Maryland Developmental Disabilities Administration Waiver Advisory Council - Establishment,"Establishing the Maryland Developmental Disabilities Administration Waiver Advisory Council to advise and provide recommendations to the Developmental Disabilities Administration on system design, service delivery, and quality enhancement strategies for the Medicaid waiver programs operated by the Administration.","This bill establishes the Maryland Developmental Disabilities Administration Waiver Advisory Council to advise on system design, service delivery, and quality strategies for Medicaid waiver programs for individuals with developmental disabilities.",True,2025,0,0.0,Maryland Department of Health,"Individuals with developmental disabilities, their families, service providers, advocacy groups, and related state agencies",The bill does not directly address access to capital for small business owners.,1.0
2025 Regular Session,HB1251,Hospitals and Medical Professional Liability Insurers - Obstetric Services Policies (Doula and Birth Policy Transparency Act),"Requiring certain hospitals to adopt certain policies relating to obstetric services and to provide evidence to the Maryland Department of Health that the hospital has the policies; requiring the Maryland Department of Health to provide certain policies to the public on request; and requiring insurers that issue or deliver medical professional liability insurance policies in the State to provide the Maryland Department of Health, on request, with information regarding the insurer's policy regarding coverage of obstetric services.","The bill requires hospitals to adopt policies supporting doulas, informed consent for significant medical interventions, and transfer procedures for obstetric care. It also mandates insurers to provide information on obstetric coverage to the Maryland Department of Health.",True,2025,0,0.0,Maryland Department of Health,"Pregnant individuals, hospitals, doulas, and insurers in Maryland","The bill primarily focuses on policies and transparency related to obstetric services, with no direct funding or financial programs for small business capital access.",1.0
2025 Regular Session,HB1253,Department of Social and Economic Mobility - Established,"Establishing the Department of Social and Economic Mobility; providing for the Secretary of Social and Economic Mobility; providing the purpose of the Department is to provide support for units of State government, individuals, and businesses for the maintenance of social equity policies in the State; establishing the Department of Social and Economic Mobility Special Fund; requiring the Governor to include in the annual budget bill a certain appropriation from the Transportation Trust Fund to the Fund; etc.","This bill establishes the Maryland Department of Social Equity and Economic Mobility, consolidates various social equity programs and offices, and creates a special fund to support social equity initiatives, including those related to small, minority, and women-owned businesses and cannabis industry participation.",True,2026,0,0.0,Maryland Department of Social Equity and Economic Mobility,"Individuals, small businesses, minority and women-owned businesses, and communities disproportionately impacted by the war on drugs in Maryland.","The bill creates programs and funds aimed at supporting social equity and minority business enterprises, which could significantly impact access to capital for these groups.",8.0
2025 Regular Session,HB1259,Anne Arundel County - Alcoholic Beverages - License and Permit Distance Requirements,"Authorizing the Board of Liquor Commissioners for Anne Arundel County to issue a certain dancing permit to the holder of a Class H beer and wine or beer, wine, and liquor license for a licensed premises located within 1,000 feet of a school located at the Annapolis Mall, rather than prohibiting the Board from doing so; and authorizing the Board to issue a new Class B beer and wine or beer, wine, and liquor license to an establishment located within 1,000 feet of a school located at the Annapolis Mall.","The bill relaxes restrictions on issuing certain alcohol licenses and permits within 1,000 feet of schools and places of worship in Anne Arundel County, allowing more flexibility for license issuance and permits near schools.",False,2025,2025,0.0,Anne Arundel County Board of Liquor Commissioners,"Alcohol license holders, businesses near schools and places of worship, residents of Anne Arundel County",The bill does not directly impact access to capital for small business owners.,1.0
2025 Regular Session,HB1281,Anne Arundel County - Alcoholic Beverages - Limited Special Event Permit,"Authorizing the Board of License Commissioners for Anne Arundel County to issue a limited special event permit to holders of certain alcoholic beverages licenses; and authorizing a permit holder to provide music, dancing, and other legal forms of entertainment.","The bill authorizes the issuance of a limited cultural special event permit in Anne Arundel County, allowing license holders to provide cultural music, dancing, and entertainment on specific dates, with certain restrictions and fees.",True,2025,2025,0.0,Board of License Commissioners for Anne Arundel County,"Alcoholic beverage license holders, cultural event organizers, residents of Anne Arundel County","The program could facilitate cultural events that may boost local businesses, but it does not directly impact access to capital for small business owners.",4.0
2025 Regular Session,HB1283,Charles County - Off-Highway Recreational Vehicles - Regulation and Enforcement,Authorizing Charles County to regulate the operation of off-highway recreational vehicles in the county and to impound an off-highway recreational vehicle that is the subject of certain alleged motor vehicle violations.,"The bill authorizes Charles County to regulate the operation of off-highway recreational vehicles, including registration, age restrictions, and enforcement measures such as impoundment of vehicles involved in violations.",True,2025,2025,0.0,Charles County government,"Off-highway recreational vehicle users in Charles County, local residents, law enforcement agencies",The bill does not directly impact access to capital for small business owners.,1.0
2025 Regular Session,HB1292,Health Insurance - Provider Directory - Required Updates,"Renaming ""network directory"" to be ""provider directory"" to conform to a certain federal law; altering the time period from 15 to 2 working days within which certain carriers are required to update the information that must be made available in the carrier's provider directory on the Internet; altering the information required to be included in a provider directory; requiring that a provider directory in printed form include a statement regarding the accuracy of the provider information; etc.","This bill updates regulations concerning health insurance provider directories, including renaming 'network directory' to 'provider directory', setting update frequency requirements, and establishing standards for accuracy and notification procedures.",False,2025,2025,0.0,Maryland Insurance Commissioner,"Health insurance enrollees, health care providers, health care facilities, and health insurance carriers in Maryland","The bill primarily focuses on provider directory accuracy and transparency, with no direct impact on small business access to capital.",1.0
2025 Regular Session,HB1293,Baltimore City - Office of the Sheriff - Neighborhood Services Unit,Establishing the Neighborhood Services Unit within the Office of the Sheriff of Baltimore City; requiring the Neighborhood Services Unit and the Board of License Commissioners of Baltimore City to work in partnership to enforce the alcoholic beverages laws of Baltimore City and to enter into a memorandum of understanding that specifies the respective roles and responsibilities of the parties and funding in connection with the partnership; expanding the authorized uses of certain revenue to include the Neighborhood Services Unit; etc.,"The bill establishes a Neighborhood Services Unit within the Baltimore City Sheriff's Office, which will work in partnership with the Board of License Commissioners to enforce alcohol laws and perform other duties. It also details funding mechanisms, including revenue from certain surcharges.",True,2025,2025,0.0,Baltimore City Sheriff's Office and the Board of License Commissioners of Baltimore City,"Residents of Baltimore City, small business owners involved in alcohol licensing, and community members impacted by law enforcement and licensing enforcement activities.","The bill's focus is on law enforcement and licensing enforcement, with no direct programs aimed at increasing access to capital for small businesses.",1.0
2025 Regular Session,HB1294,Commercial Law - Credit Regulation - Earned Wage Access and Credit Modernization,Subjecting certain earned wage access products to the Maryland Consumer Loan Law and other provisions that regulate entities that provide consumer credit; restricting the acceptance of tips by certain lenders under certain circumstances; providing for the licensing or registration of certain entities offering earned wage access products with certain exemptions; regulating earned wage access service agreements; limiting the costs and fees associated with obtaining an earned wage access product; etc.,"This bill regulates earned wage access products by subjecting them to consumer credit laws, establishing licensing requirements for providers, and setting rules for disclosures, fees, and consumer protections.",True,2025,2030,0.0,Maryland Office of Financial Regulation,Consumers seeking earned wage access and providers of earned wage access services in Maryland,"The bill's provisions primarily focus on consumer protections and licensing, with limited direct impact on small business access to capital.",3.0
2025 Regular Session,HB1296,Environment - Managed Aquifer Recharge Pilot Program - Establishment,Prohibiting a person from performing groundwater augmentation except under certain circumstances; establishing the Managed Aquifer Recharge Pilot Program to regulate and evaluate the use of treated reclaimed water as a source for groundwater augmentation through managed aquifer recharge permits; requiring the demonstration facility to address a groundwater supply or quality problem that is anticipated to occur in the next 25 years; etc.,"The bill establishes a Managed Aquifer Recharge Pilot Program in Maryland to test the use of treated reclaimed water for groundwater augmentation, including permitting, regulation, and monitoring of the process.",True,2025,2036,0.0,Department of the Environment,"Groundwater users, environmental agencies, industrial water users, and communities affected by groundwater quality and supply issues",The program could improve access to capital for small businesses involved in water treatment and infrastructure development by providing a regulated testing environment and potential future expansion.,7.0
2025 Regular Session,HB1301,"Maryland Medical Assistance Program, Maryland Children’s Health Program, and Health Insurance – Transfers to Special Pediatric Hospitals – Prior Authorizations","Prohibiting the Maryland Medical Assistance Program, the Maryland Children's Health Program, managed care organizations, and certain health insurers, nonprofit health service plans, and health maintenance organizations from requiring prior authorization for a transfer to a special pediatric hospital.","The bill prohibits the Maryland Medical Assistance Program, Maryland Children’s Health Program, managed care organizations, and certain health insurers from requiring prior authorization for transfers to special pediatric hospitals, starting January 1, 2026.",True,2026,0,0.0,Maryland Department of Health,Children under 22 years old and individuals with co-occurring physical and behavioral health conditions who need transfers to special pediatric hospitals,"The bill's impact on access to capital is indirect, focusing on healthcare access rather than financial capital for small businesses.",3.0
2025 Regular Session,HB1310,Prescription Drug Repository Program - Revisions,"Altering the Prescription Drug Repository Program, including by allowing certain entities located in another state to participate in the Program as drop-off sites and repositories, including over-the-counter drugs under the Program, and altering the individuals who are eligible to receive drugs or medical supplies under the Program; and altering the persons for whom and the activities with respect to which certain immunity is provided under the Program.","This bill revises the Maryland Prescription Drug Repository Program to include participation by out-of-state entities as drop-off sites and repositories, allowing donation, dispensing, and disposal of prescription drugs, over-the-counter drugs, and medical supplies, with updated regulations and standards.",True,2025,0,0.0,Maryland State Board of Pharmacy,"Eligible patients, pharmacies, drop-off sites, medical supply donors, and out-of-state entities participating in the program","The program primarily facilitates donation and redistribution of drugs, not direct access to capital for small businesses.",2.0
2025 Regular Session,HB1315,Vaccinations by Pharmacists and Health Insurance Coverage for Immunizations,"Altering the vaccinations that a pharmacist may administer, subject to certain requirements, to an individual of at least a certain age; altering the vaccinations included in the minimum package of child wellness services for which certain health insurers and nonprofit health service plans are required to provide coverage to include those recommended by the Advisory Committee on Immunization Practices of the Centers for Disease Control and Prevention as of December 31, 2024.","The bill expands the vaccinations pharmacists can administer to include individuals aged 3 and above, and updates the list of vaccines. It also requires certain health insurance plans to cover a minimum package of child wellness services, including immunizations and developmental screenings.",True,2025,0,0.0,Maryland Department of Health and the Maryland Insurance Administration,"Children, parents, healthcare providers, and health insurance policyholders in Maryland","The bill primarily focuses on healthcare services and insurance coverage, with no direct programs aimed at increasing access to capital for small businesses.",1.0
2025 Regular Session,HB1316,Primary and Secondary Education - Youth-Centric Technology and Social Media Resource Guide,"Requiring the National Center for School Mental Health at the University of Maryland School of Medicine, in consultation with the State Department of Education, to develop and publish a youth-centric technology and social media resource guide by the 2027-2028 school year; requiring the guide to be distributed, beginning with the 2027-2028 school year, to each public school and the parent teacher organization for each public school and posted on the websites of the Department and each county board; etc.","The bill requires the University of Maryland's National Center for School Mental Health, in consultation with the Maryland Department of Education, to develop and publish a youth-centric technology and social media resource guide for public school students, starting with the 2027-2028 school year. The guide aims to provide age-appropriate information and best practices for safe and informed use of technology and social media, and will be updated annually.",True,2027,2030,350000.0,National Center for School Mental Health at the University of Maryland School of Medicine in consultation with the Maryland Department of Education,"Public school students, parents, guardians, and educators in Maryland","The program is focused on providing information and guidance on technology use and safety, not on financial services or access to capital.",1.0
2025 Regular Session,HB1322,Natural Resources - Vessels - Carbon Monoxide Warning Labels (Matthew's Law),"Prohibiting a person from operating a gasoline-powered vessel manufactured after July 31, 2007, that has accommodation spaces, swim platforms, or aft lounging areas on the waters of the State unless the vessel has carbon monoxide warning labels affixed in conspicuous locations in the vicinity of both the transom and the helm of the vessel; and prohibiting the Department of Natural Resources from imposing a penalty on a person that violates the Act.",This bill prohibits the operation of certain gasoline-powered vessels with specific features unless they have carbon monoxide warning labels affixed in designated locations. It also states that the Department of Natural Resources cannot impose penalties for violations.,False,2025,2025,0.0,Department of Natural Resources,"Operators of gasoline-powered vessels with accommodation spaces, swim platforms, or aft lounging areas in Maryland waters",The bill does not directly impact access to capital for small business owners.,1.0
2025 Regular Session,HB1334,Garrett County - Bids and Contracts - Advertisement Exceptions,"Providing that, in Garrett County, a certain requirement to advertise for bids does not apply to a certain contract for goods or services procured on an as-needed basis over time or for certain vehicles.","This bill exempts Garrett County from the requirement to advertise for bids for certain contracts, specifically for goods or services procured on an as-needed basis over time or for certain vehicles, allowing for more flexible procurement processes.",False,2025,2025,0.0,Garrett County Government,"Garrett County government, vendors, and residents of Garrett County","The bill potentially simplifies procurement processes for Garrett County, which could indirectly impact small business access to capital by reducing administrative barriers.",4.0
